{
  "schemaVersion": "ecir/1",
  "sourceManifestDigest": "sha256:a1c87f241b569d9d9d1e054dc69aa61a09263003e0ea030a9112d910735dbfec",
  "requirements": [
    {
      "source": {
        "key": "sources/invoicing-requirements.md#REQ-INV-001",
        "originalId": "REQ-INV-001",
        "document": "sources/invoicing-requirements.md",
        "location": "## REQ-INV-001",
        "revision": "fixture-v1",
        "contentDigest": "sha256:6634f7ea37d47d59b7e7ce4b7b4385d64988cb270bdcac7c500c505aaa423970"
      },
      "disposition": {
        "kind": "modeled"
      },
      "nodeIds": [
        "COH-INVOICE-WORKFLOW",
        "CON-INVOICE-WORKFLOW",
        "Q-FIN-001",
        "VER-INVOICE-WORKFLOW"
      ]
    },
    {
      "source": {
        "key": "sources/invoicing-requirements.md#REQ-INV-002",
        "originalId": "REQ-INV-002",
        "document": "sources/invoicing-requirements.md",
        "location": "## REQ-INV-002",
        "revision": "fixture-v1",
        "contentDigest": "sha256:6634f7ea37d47d59b7e7ce4b7b4385d64988cb270bdcac7c500c505aaa423970"
      },
      "disposition": {
        "kind": "modeled"
      },
      "nodeIds": [
        "COH-INVOICE-WORKFLOW",
        "CON-INVOICE-WORKFLOW",
        "DEC-FIN-001",
        "VER-INVOICE-WORKFLOW"
      ]
    },
    {
      "source": {
        "key": "sources/invoicing-requirements.md#REQ-INV-003",
        "originalId": "REQ-INV-003",
        "document": "sources/invoicing-requirements.md",
        "location": "## REQ-INV-003",
        "revision": "fixture-v1",
        "contentDigest": "sha256:6634f7ea37d47d59b7e7ce4b7b4385d64988cb270bdcac7c500c505aaa423970"
      },
      "disposition": {
        "kind": "modeled"
      },
      "nodeIds": [
        "COH-PAYMENT-PERSISTENCE",
        "CON-PAYMENT-PERSISTENCE",
        "DEC-FIN-002",
        "VER-PAYMENT-PERSISTENCE"
      ]
    }
  ],
  "nodes": [
    {
      "id": "COH-INVOICE-WORKFLOW",
      "kind": "cohort",
      "requirementKeys": [
        "sources/invoicing-requirements.md#REQ-INV-001",
        "sources/invoicing-requirements.md#REQ-INV-002"
      ],
      "dependsOn": [],
      "justification": "generated by Ordo.Construction"
    },
    {
      "id": "COH-PAYMENT-PERSISTENCE",
      "kind": "cohort",
      "requirementKeys": [
        "sources/invoicing-requirements.md#REQ-INV-003"
      ],
      "dependsOn": [],
      "justification": "handwritten extension; outside the Ordo vocabulary"
    },
    {
      "id": "CON-INVOICE-WORKFLOW",
      "kind": "contract",
      "requirementKeys": [
        "sources/invoicing-requirements.md#REQ-INV-001",
        "sources/invoicing-requirements.md#REQ-INV-002"
      ],
      "dependsOn": [],
      "justification": "invoice workflow"
    },
    {
      "id": "CON-PAYMENT-PERSISTENCE",
      "kind": "contract",
      "requirementKeys": [
        "sources/invoicing-requirements.md#REQ-INV-003"
      ],
      "dependsOn": [],
      "justification": "payment persistence boundary"
    },
    {
      "id": "DEC-FIN-001",
      "kind": "decision",
      "requirementKeys": [
        "sources/invoicing-requirements.md#REQ-INV-002"
      ],
      "dependsOn": [],
      "justification": "A single payment above 10,000.00 in the invoice's currency is refused with PAYMENT_LIMIT_EXCEEDED. No customer category is exempt."
    },
    {
      "id": "DEC-FIN-002",
      "kind": "decision",
      "requirementKeys": [
        "sources/invoicing-requirements.md#REQ-INV-003"
      ],
      "dependsOn": [],
      "justification": "Only the payments-service role may write payments. Writes accept only validated, applied payments."
    },
    {
      "id": "Q-FIN-001",
      "kind": "deferral",
      "requirementKeys": [
        "sources/invoicing-requirements.md#REQ-INV-001"
      ],
      "dependsOn": [],
      "justification": "May an invoice that has received a partial payment be voided, and if so what happens to the payment received?"
    },
    {
      "id": "VER-INVOICE-WORKFLOW",
      "kind": "verificationObligation",
      "requirementKeys": [
        "sources/invoicing-requirements.md#REQ-INV-001",
        "sources/invoicing-requirements.md#REQ-INV-002"
      ],
      "dependsOn": [],
      "justification": "independent verification (Dokimos)"
    },
    {
      "id": "VER-PAYMENT-PERSISTENCE",
      "kind": "verificationObligation",
      "requirementKeys": [
        "sources/invoicing-requirements.md#REQ-INV-003"
      ],
      "dependsOn": [],
      "justification": "compile-negative probes and independent verification"
    }
  ]
}
