{
  "schemaVersion": "ecir/1",
  "sourceManifestDigest": "sha256:3a9e79d3842ba6e16ab27fa79b6e3eed4f005ab85f1e63189937a804dd293c12",
  "requirements": [
    {
      "source": {
        "key": "synthetic/gate.md#GATE-1",
        "originalId": "GATE-1",
        "document": "synthetic/gate.md",
        "location": "GATE-1",
        "revision": "synthetic-1",
        "contentDigest": "sha256:ec513189ba1f03530af93a5c0237fbf7dc13a760ce63da340a385111cc991af6"
      },
      "disposition": {
        "kind": "modeled"
      },
      "nodeIds": [
        "DEC-GATE",
        "CON-GATE",
        "COH-GATE",
        "VER-GATE"
      ]
    },
    {
      "source": {
        "key": "synthetic/gate.md#GATE-2",
        "originalId": "GATE-2",
        "document": "synthetic/gate.md",
        "location": "GATE-2",
        "revision": "synthetic-1",
        "contentDigest": "sha256:379b01c0bde157c6f8867fdcca89d031bc8e79e2ec05cf49e6d3cefe599e9487"
      },
      "disposition": {
        "kind": "modeled"
      },
      "nodeIds": [
        "DEC-GATE",
        "CON-GATE",
        "COH-GATE",
        "VER-GATE"
      ]
    },
    {
      "source": {
        "key": "synthetic/gate.md#GATE-3",
        "originalId": "GATE-3",
        "document": "synthetic/gate.md",
        "location": "GATE-3",
        "revision": "synthetic-1",
        "contentDigest": "sha256:648e1c24a1e3c2a76da24a38b282f28d4f40cb6f38053d4110048c9882077c75"
      },
      "disposition": {
        "kind": "modeled"
      },
      "nodeIds": [
        "DEC-GATE",
        "CON-GATE",
        "COH-GATE",
        "VER-GATE"
      ]
    },
    {
      "source": {
        "key": "synthetic/gate.md#GATE-4",
        "originalId": "GATE-4",
        "document": "synthetic/gate.md",
        "location": "GATE-4",
        "revision": "synthetic-1",
        "contentDigest": "sha256:e6cce2cac2763a99636d787f16286046702ddb4e1e477f466066983ffcf91582"
      },
      "disposition": {
        "kind": "modeled"
      },
      "nodeIds": [
        "DEC-GATE",
        "CON-GATE",
        "COH-GATE",
        "VER-GATE"
      ]
    },
    {
      "source": {
        "key": "synthetic/gate.md#GATE-6",
        "originalId": "GATE-6",
        "document": "synthetic/gate.md",
        "location": "GATE-6",
        "revision": "synthetic-1",
        "contentDigest": "sha256:fb10eed3b8d35e6650919e2c39a30062c286c03d4999d159c21d3372dd826cfc"
      },
      "disposition": {
        "kind": "modeled"
      },
      "nodeIds": [
        "DEC-GATE",
        "CON-GATE",
        "COH-GATE",
        "VER-GATE"
      ]
    }
  ],
  "nodes": [
    {
      "id": "DEC-GATE",
      "kind": "decision",
      "requirementKeys": [
        "synthetic/gate.md#GATE-1",
        "synthetic/gate.md#GATE-2",
        "synthetic/gate.md#GATE-3",
        "synthetic/gate.md#GATE-4",
        "synthetic/gate.md#GATE-6"
      ],
      "dependsOn": [],
      "justification": "synthetic fixture"
    },
    {
      "id": "CON-GATE",
      "kind": "contract",
      "requirementKeys": [
        "synthetic/gate.md#GATE-1",
        "synthetic/gate.md#GATE-2",
        "synthetic/gate.md#GATE-3",
        "synthetic/gate.md#GATE-4",
        "synthetic/gate.md#GATE-6"
      ],
      "dependsOn": [],
      "justification": "synthetic fixture"
    },
    {
      "id": "COH-GATE",
      "kind": "cohort",
      "requirementKeys": [
        "synthetic/gate.md#GATE-1",
        "synthetic/gate.md#GATE-2",
        "synthetic/gate.md#GATE-3",
        "synthetic/gate.md#GATE-4",
        "synthetic/gate.md#GATE-6"
      ],
      "dependsOn": [],
      "justification": "synthetic fixture"
    },
    {
      "id": "VER-GATE",
      "kind": "verificationObligation",
      "requirementKeys": [
        "synthetic/gate.md#GATE-1",
        "synthetic/gate.md#GATE-2",
        "synthetic/gate.md#GATE-3",
        "synthetic/gate.md#GATE-4",
        "synthetic/gate.md#GATE-6"
      ],
      "dependsOn": [],
      "justification": "synthetic fixture"
    }
  ]
}
