{
  "schemaVersion": "ecir/1",
  "sourceManifestDigest": "sha256:aaaaaaaaaaaaaaaaaaaaaaaaaaaaaaaaaaaaaaaaaaaaaaaaaaaaaaaaaaaaaaaa",
  "requirements": [
    {
      "source": {
        "key": "requirements/domain.md#R-001",
        "originalId": "R-001",
        "document": "requirements/domain.md",
        "location": "L12",
        "revision": "rev-1",
        "contentDigest": "sha256:bbbbbbbbbbbbbbbbbbbbbbbbbbbbbbbbbbbbbbbbbbbbbbbbbbbbbbbbbbbbbbbb"
      },
      "disposition": {
        "kind": "modeled"
      },
      "nodeIds": [
        "DEC-CONFIRM",
        "VERIFY-CONFIRM",
        "COHORT-CONFIRM"
      ]
    },
    {
      "source": {
        "key": "requirements/operations.md#R-001",
        "originalId": "R-001",
        "document": "requirements/operations.md",
        "location": "L8",
        "revision": "rev-1",
        "contentDigest": "sha256:cccccccccccccccccccccccccccccccccccccccccccccccccccccccccccccccc"
      },
      "disposition": {
        "kind": "deferred",
        "reason": "release scope awaiting operator approval"
      },
      "nodeIds": [
        "DEF-OPERATIONS"
      ]
    }
  ],
  "nodes": [
    {
      "id": "DEC-CONFIRM",
      "kind": "decision",
      "requirementKeys": [
        "requirements/domain.md#R-001"
      ],
      "dependsOn": [],
      "justification": "domain transition must be authorized"
    },
    {
      "id": "VERIFY-CONFIRM",
      "kind": "verificationObligation",
      "requirementKeys": [
        "requirements/domain.md#R-001"
      ],
      "dependsOn": [
        "DEC-CONFIRM"
      ]
    },
    {
      "id": "COHORT-CONFIRM",
      "kind": "cohort",
      "requirementKeys": [
        "requirements/domain.md#R-001"
      ],
      "dependsOn": [
        "DEC-CONFIRM"
      ]
    },
    {
      "id": "DEF-OPERATIONS",
      "kind": "deferral",
      "requirementKeys": [
        "requirements/operations.md#R-001"
      ],
      "dependsOn": []
    }
  ]
}
